practice_id,practice_name,description
1,SAP,SAP Implementation and Advisory Services
2,Audit & Assurance,Financial Statement Audits and Assurance Services
3,Cloud Services,"AWS, Azure, and GCP Implementation Advisory"
4,Management Consulting,Strategy and Operations Consulting
5,Deal Advisory,Mergers & Acquisitions and Transaction Services
6,Risk Consulting,"Risk Management, Compliance, and Governance"
7,Technology Consulting,Digital Transformation and Enterprise Technologies
8,ESG Advisory,"Environmental, Social, and Governance Services"
